Category,Brand,ProductName,Description,Features,SKU,Price,ImageURL
Chemicals,3M,Stone Floor Protector (1L),Premium stone floor sealant and protector for commercial applications.,"Form: Liquid Penetrating Sealer; Volume: 1L; Coverage: 200-300 sq ft; Features: Advanced fluoropolymer protection, prevents staining, UV resistant, enhances natural stone appearance, professional-grade durability, 2-year protection.",SFP1000,22.5,./images/products/3m - stone floor protector (1l).jpg
Machines,Berry,Handi Trash Bag,"A durable, large-capacity waste collection bag, ideal for janitorial carts.","Material: Heavy-duty vinyl/nylon; Capacity: 100L; Features: Rip-resistant, waterproof, easy to clean, fits most standard janitorial carts, reinforced handles.",BHY001,15,./images/products/berry - handi trash bag.jpg
Machines,Bissell,BigGreen BG355,Commercial-grade vacuum cleaner for efficient dry vacuuming in various settings.,"Type: Upright Vacuum; Motor: 1000W; Cleaning Path: 35cm; Filtration: HEPA; Cord Length: 12m; Features: Durable construction, strong suction, ideal for carpets and hard floors, lightweight design.",BBG355,180,./images/products/bissell - biggreen bg355.jpg
Chemicals,Bona,Hardwood Floor Polish (1L),Protective polish designed to restore shine and protect hardwood floors from wear.,"Form: Liquid; Volume: 1L; Finish: Satin/Gloss; Features: Non-toxic, quick-drying, fills micro-scratches, enhances natural wood grain, lasts for months.",HFP1000,9.5,./images/products/bona - hardwood floor polish (1l).jpg
Recycling,Brute,Industrial Waste Bins (240L),"Large, robust wheeled bins for industrial and commercial waste collection.","Capacity: 240L; Material: HDPE; Features: Heavy-duty wheels, reinforced rim, UV stabilized, suitable for outdoor and heavy use.",IWB240,35,./images/products/brute - industrial waste bins (240l).jpg
Chemicals,Clorox,Disinfecting Wipes (75 count),Ready-to-use spray for disinfecting and cleaning common household surfaces.,"Form: Aerosol Spray; Volume: 750ml; Scent: Fresh; Features: Kills 99.9% of viruses and bacteria, multi-surface safe, eliminates odors, no wiping needed for disinfection.",HDS750,3,./images/products/clorox - disinfecting wipes (75 count).jpg
Chemicals,Clorox,Household Disinfectant Spray (750ml),Professional-grade disinfecting wipes for thorough surface sanitization.,"Quantity: 75 wipes per canister; Active Time: 4 minutes; Features: Kills 99.9% of viruses including COVID-19, bleach-free formula, safe on multiple surfaces, EPA registered, micro-textured for better cleaning.",CDW75,8.5,./images/products/clorox - household disinfectant spray (750ml).jpg
Chemicals,Dettol,Hand Sanitizer (Standard Bottle - 500ml),Convenient size hand sanitizer bottle for personal or small office use.,"Form: Gel; Volume: 500ml; Alcohol Content: 60%; Features: Kills 99.9% of germs instantly, non-sticky formula, moisturizing, ideal for desks, reception areas, and personal use.",HSS500,4.5,./images/products/dettol - hand sanitizer (standard bottle - 500ml).jpg
Chemicals,Diversey,Multi-Surface Spray (500ml),Professional-grade all-purpose cleaner for multiple surface types.,"Type: Spray; Volume: 500ml; Scent: Fresh Citrus; Features: Concentrated formula, removes tough stains, kills 99.9% of germs, safe for all washable surfaces, leaves protective shine.",MSS500,5.8,./images/products/diversey - multi-surface spray (500ml).jpg
Chemicals,Dr Schutz,Floor Matting System,Customizable high-performance entrance matting to trap dirt and moisture.,"Material: High-twist nylon/rubber; Features: Reduces tracked-in dirt by up to 80%, slip-resistant backing, highly durable, customizable sizes and logos, easy to clean.",FMS001,22.5,./images/products/dr schutz - floor matting system.jpg
Chemicals,Febreze,Odor Neutralizer Sprays (300ml),Commercial-grade odor eliminator for professional environments.,"Type: Aerosol Spray; Volume: 300ml; Coverage: 300 sq ft; Features: Long-lasting 24-hour freshness, eliminates odors at molecular level, safe for fabrics and air, ideal for commercial spaces.",ONS300,6.5,./images/products/febreze - odor neutralizer sprays (300ml).jpg
Recycling,Glad,Trash Bags (Household - 30L - 50 count),Durable household trash bags with drawstring closure for convenient waste disposal.,"Capacity: 30L; Quantity: 50 count; Material: High-density polyethylene; Features: Drawstring closure, tear-resistant, ideal for kitchen and office waste.",TBH030,2.5,./images/products/glad - trash bags (household - 30l - 50 count).jpg
Recycling,Harmony Enterprises,Recycling Compactor (Small),Compact recycling compactor designed for efficient waste volume reduction in small businesses.,"Compaction Ratio: 4:1; Bale Weight: 10-20kg; Power: Electric; Features: Reduces waste volume, saves space, ideal for cardboard, plastics, and cans, easy to operate.",RCS001,1200,./images/products/harmony enterprises - recycling compactor (small).jpg
Machines,ISAL,ISAL 6000 Width 6cbm (Urban Sweeper),Entry-level walk-behind sweeper for small to medium indoor and outdoor areas.,"Type: Walk-behind Sweeper; Sweeping Width: 70cm; Hopper Capacity: 30L; Power: Manual/Battery; Features: Compact, easy to maneuver, simple to operate, suitable for light debris.",IPB110,700,./images/products/isal - isal 6000 width 6cbm (urban sweeper).jpg
Machines,ISAL,Ride-on sweeper PB 110,Enhanced walk-behind sweeper with increased performance for diverse applications.,"Type: Walk-behind Sweeper; Sweeping Width: 80cm; Hopper Capacity: 45L; Power: Battery; Features: Improved suction, longer run time, suitable for warehouses and carparks, robust build.",IPB111,1200,./images/products/isal - ride-on sweeper pb 110.jpg
Machines,ISAL,Ride-on sweeper PB 111,Mid-range walk-behind sweeper designed for efficient cleaning of larger areas.,"Type: Walk-behind Sweeper; Sweeping Width: 95cm; Hopper Capacity: 60L; Power: Battery/Petrol; Features: Higher sweeping capacity, durable components, effective for industrial floors, easy to operate.",IPB115,2000,./images/products/isal - ride-on sweeper pb 111.jpg
Machines,ISAL,Ride-on sweeper PB 115,Robust walk-behind sweeper for heavy-duty sweeping tasks in demanding environments.,"Type: Walk-behind Sweeper; Sweeping Width: 120cm; Hopper Capacity: 80L; Power: Petrol; Features: Powerful engine, large hopper, ideal for construction sites and large outdoor areas, superior dust control.",IPB180,3500,./images/products/isal - ride-on sweeper pb 115.jpg
Machines,ISAL,Ride-on sweeper PB 180,Top-tier walk-behind sweeper for maximum performance in extensive cleaning operations.,"Type: Walk-behind Sweeper; Sweeping Width: 150cm; Hopper Capacity: 100L; Power: Diesel; Features: Very high productivity, strong build, suitable for airports, large logistics centers, advanced filtration.",IPB200,5000,./images/products/isal - ride-on sweeper pb 180.jpg
Machines,ISAL,Ride-on sweeper PB 200,Large urban street sweeper designed for municipal road and pavement cleaning.,"Type: Urban Sweeper; Sweeping Width: 250cm (adjustable); Hopper Capacity: 6 cbm; Power: Diesel Engine; Features: High-efficiency sweeping, robust chassis, advanced dust suppression, ideal for city streets and large public areas.",ISAL6000,45000,./images/products/isal - ride-on sweeper pb 200.jpg
Chemicals,Johnson,Tile Floor Wax (750ml),"High-gloss wax for all types of tiled floors, providing protection and a durable shine.","Form: Liquid; Volume: 750ml; Finish: High-gloss; Features: Long-lasting protection, slip-resistant, easy application, suitable for ceramic, porcelain, vinyl tiles.",TFW750,6.5,./images/products/johnson - tile floor wax (750ml).jpg
Chemicals,Karcher,Industrial Floor Detergent (20L),Highly concentrated heavy-duty detergent for deep cleaning industrial and commercial floors.,"Form: Liquid Concentrate; Volume: 20L; Scent: Low odor; Features: Removes tough grease and oil, low-foaming, suitable for machine scrubbing, biodegradable, effective on concrete, epoxy, and tiled floors.",IFD20000,45,./images/products/karcher - industrial floor detergent (20l).jpg
Chemicals,Lysol,Hospital-Grade Disinfectant (5L),Powerful disinfectant proven to kill a wide range of viruses and bacteria on surfaces.,"Form: Liquid Concentrate; Volume: 5L; Scent: Clean; Features: Kills SARS-CoV-2, influenza, MRSA; multi-surface use; effective against fungi; suitable for medical facilities, schools, offices.",HGD5000,25,./images/products/lysol - hospital-grade disinfectant (5l).jpg
Tools,O-Cedar,Microfiber Mop,Highly absorbent and effective mop head for efficient floor cleaning.,"Material: Microfiber; Mop Head Type: Flat/Strip; Features: High absorbency, machine washable, effective on all floor types, compatible with standard handles.",MFM001,4.5,./images/products/o-cedar - microfiber mop.jpg
Tools,OXO Good Grips,Scrub Brush (All-Purpose),Versatile and durable scrub brush for tough cleaning jobs on multiple surfaces.,"Bristle Type: Stiff synthetic; Handle: Ergonomic, non-slip; Features: Built-in scraper, suitable for tiles, grout, kitchen, bathroom, durable construction.",SBA001,2.2,./images/products/oxo good grips - scrub brush (all-purpose).jpg
Machines,PowrFlite,PFX 900S carpet extractor,Professional portable carpet extractor for deep cleaning carpets and upholstery.,"Type: Carpet Extractor; Tank Capacity: 34L; Motor: 2-stage vacuum motor; Pump Pressure: 900 PSI; Features: High pressure for deep cleaning, portable design, ideal for commercial carpet maintenance.",PFP900S,950,./images/products/powrflite - pfx 900s carpet extractor.jpg
Chemicals,Purell,Hand Sanitizer Bulk (5L),Bulk liquid hand sanitizer for large commercial or institutional use.,"Form: Liquid Gel; Volume: 5L; Alcohol Content: 70%; Features: Kills 99.9% of germs, quick-drying, no-rinse formula, ideal for refilling dispensers, dermatologist-tested.",HSB5000,18,./images/products/purell - hand sanitizer bulk (5l).jpg
Chemicals,Purell,Hand Sanitizer Wipes (100 count),Pre-moistened wipes for convenient hand sanitization on the go.,"Quantity: 100 wipes; Alcohol Content: 70%; Features: Kills 99.9% of germs, durable, non-linting, convenient canister, dermatologist-tested.",HSW100,7.5,./images/products/purell - hand sanitizer wipes (100 count).jpg
Machines,ROOTS,Escalator RootsScrub E 4550 ES,Battery-operated walk-behind scrubber-dryer for efficient floor cleaning.,"Type: Walk-behind Scrubber Dryer; Cleaning Width: 45cm; Solution Tank: 50L; Recovery Tank: 55L; Power: 24V Battery; Run Time: 3 hours; Features: Robust design, user-friendly controls, suitable for various hard floors.",RE4550ES,1800,./images/products/roots - escalator rootsscrub e 4550 es.jpg
Machines,ROOTS,india truck mounted sweeper,High-capacity truck-mounted sweeper for extensive road cleaning operations.,"Type: Truck-Mounted Sweeper; Hopper Capacity: 8-10 cbm; Sweeping Width: 300cm (variable); Power: Truck Engine; Features: Industrial-grade, high performance, ideal for highways, large industrial complexes, superior debris collection.",RTMTruck,80000,./images/products/roots - india truck mounted sweeper.jpg
Tools,Rubbermaid,Dustpan and Brush Set,Convenient set for quick and efficient sweep-ups of dust and small debris.,"Material: Durable plastic; Brush Type: Soft bristles; Features: Long handle dustpan, fine-bristle brush, hangs for easy storage, ideal for quick cleanups.",DPB001,3,./images/products/rubbermaid - dustpan and brush set.jpg
Tools,Scotch,Brite - Lint Roller (Pack of 2),"Removes lint, dust, and pet hair from clothing, upholstery, and other surfaces.","Quantity: Pack of 2; Sheets per roll: 60; Features: Extra sticky adhesive, easy-tear sheets, ergonomic handle, effective on various fabrics.",LRP002,1.8,./images/products/scotch - brite - lint roller (pack of 2).jpg
Tools,Scotch,Brite - Reusable Cleaning Cloths 3M (Pack of 5),Highly absorbent and durable microfiber cloths for various cleaning applications.,"Material: Microfiber; Quantity: Pack of 5; Size: 30x30cm; Features: Streak-free cleaning, lint-free, machine washable, ideal for surfaces, glass, and dusting.",RCC005,3.8,./images/products/scotch - brite - reusable cleaning cloths 3m (pack of 5).jpg
Tools,Swiffer,Extendable Duster (Microfiber),Flexible and extendable duster to reach high and difficult areas easily.,"Material: Microfiber; Extension Length: Up to 1.5m; Features: Traps dust, washable head, flexible for tight spaces, lightweight.",EDM001,6,./images/products/swiffer - extendable duster (microfiber).jpg
Machines,TELEMET,CUBOMATIC SANISPRAY 120,Automatic disinfection and sanitization spraying machine for large area coverage.,"Type: Automatic Sprayer; Tank Capacity: 120L; Coverage Area: [Insert Area/Hour]; Features: Automated operation, fine mist for even coverage, ideal for hospitals, offices, public transport, highly effective disinfection.",TCS120,1500,./images/products/telemet - cubomatic sanispray 120.jpg
Machines,TSM,Aria 240,A compact ride-on floor scrubber for efficient cleaning in medium-sized areas.,"Type: Ride-on Scrubber; Cleaning Width: 60cm; Run Time: 3-4 hours; Solution Tank: 70L; Recovery Tank: 75L; Noise Level: 68 dB; Power: 24V Battery; Features: Compact design, easy maneuverability, high productivity, suitable for hard floors.",TMA240,2500,./images/products/tsm - aria 240.jpg
Machines,TSM,Durashine 13,Walk-behind sweeper for effective dust and debris collection in small to medium areas.,"Type: Walk-behind Sweeper; Sweeping Width: 75cm; Hopper Capacity: 40L; Power: Manual/Battery; Features: Ergonomic handle, easy to empty, suitable for indoor/outdoor use, efficient dust control.",TDS375,850,./images/products/tsm - durashine 13.jpg
Machines,TSM,Durashine 17,Compact single-disc floor polisher for high-gloss finishing on various floor types.,"Type: Single-Disc Polisher; Pad Diameter: 13 inches (33cm); Motor: 1100W; Speed: 150 RPM; Noise Level: 60 dB; Features: Lightweight, easy to maneuver, ideal for small areas, versatile for scrubbing and polishing.",TDS13,380,./images/products/tsm - durashine 17.jpg
Machines,TSM,Durashine 20,Battery-powered walk-behind sweeper for silent and efficient large area sweeping.,"Type: Walk-behind Sweeper; Sweeping Width: 130cm; Hopper Capacity: 80L; Power: 24V Battery; Run Time: 3-4 hours; Features: Large capacity, quiet operation, ideal for warehouses and large spaces, efficient dust filtration.",TDS130B,2800,./images/products/tsm - durashine 20.jpg
Machines,TSM,Durasweep 375,Medium-sized single-disc floor polisher for versatile floor maintenance tasks.,"Type: Single-Disc Polisher; Pad Diameter: 17 inches (43cm); Motor: 1300W; Speed: 175 RPM; Noise Level: 62 dB; Features: Robust construction, versatile for scrubbing, polishing, and buffing, suitable for medium areas.",TDS17,450,./images/products/tsm - durasweep 375.jpg
Machines,TSM,DURASWEEP_130B,Large single-disc floor polisher designed for heavy-duty polishing and maintenance.,"Type: Single-Disc Polisher; Pad Diameter: 20 inches (50cm); Motor: 1500W; Speed: 175 RPM; Noise Level: 65 dB; Features: High power, efficient for large areas, suitable for stripping, scrubbing, and high-speed polishing.",TDS20,550,./images/products/tsm - durasweep_130b.jpg
Machines,TSM,Grande Brio 35E,Compact scrubber dryer for professional cleaning of hard floors in confined spaces.,"Type: Walk-behind Scrubber Dryer; Cleaning Width: 35cm; Solution Tank: 15L; Recovery Tank: 16L; Power: 230V; Features: Foldable handle, quiet operation, ideal for small shops and offices, easy to use.",TIS135ST,1200,./images/products/tsm - grande brio 35e.jpg
Machines,TSM,Grande Brio 45E,Compact electric walk-behind scrubber for small to medium commercial spaces.,"Type: Walk-behind Scrubber Dryer; Cleaning Width: 35cm; Solution Tank: 18L; Recovery Tank: 20L; Power: 230V; Features: Easy to use, excellent maneuverability, ideal for retail, offices, and restaurants.",TGB35E,1500,./images/products/tsm - grande brio 45e.jpg
Machines,TSM,Grande Brio RIDE ON 145-850,Medium-sized electric walk-behind scrubber offering high productivity.,"Type: Walk-behind Scrubber Dryer; Cleaning Width: 45cm; Solution Tank: 25L; Recovery Tank: 28L; Power: 230V; Features: Increased tank capacity, higher productivity, ergonomic design, suitable for schools, hospitals, supermarkets.",TGB45E,1800,./images/products/tsm - grande brio ride on 145-850.jpg
Machines,TSM,ITALA sweeper 135 ST,Heavy-duty ride-on scrubber for efficient cleaning of very large commercial and industrial spaces.,"Type: Ride-on Scrubber Dryer; Cleaning Width: 85cm; Solution Tank: 145L; Recovery Tank: 150L; Power: 36V Battery; Run Time: 4-5 hours; Features: High capacity, comfortable operator seat, excellent maneuverability, suitable for large supermarkets, warehouses, malls.",TGB145R,7500,./images/products/tsm - itala sweeper 135 st.jpg
Tools,Unger,Squeegee (Window),Professional-grade squeegee for streak-free window cleaning.,"Blade Material: Rubber; Handle Material: Stainless Steel; Blade Width: 35cm; Features: Ergonomic handle, replaceable blade, perfect for commercial window cleaning.",SWQ001,4.5,./images/products/unger - squeegee (window).jpg
Chemicals,Unilever,Universal Liquid Detergent (5L),Concentrated liquid detergent for versatile cleaning of various washable surfaces.,"Type: Liquid Concentrate; Volume: 5L; Scent: Original; Features: High foaming, effective on grease and dirt, biodegradable, suitable for floors, walls, and general surfaces.",ULD5000,8,./images/products/unilever - universal liquid detergent (5l).jpg
Tools,Vileda,Heavy Duty Cotton Mop (FC-22),Durable rubber gloves providing protection and grip for various cleaning tasks.,"Material: Natural Latex Rubber; Size: Medium; Features: Flock-lined for comfort, textured grip, chemical resistant, reusable.",RGM001,1.5,./images/products/vileda - heavy duty cotton mop (fc-22).jpg
Tools,Vileda,Rubber Gloves (Medium),Traditional and robust cotton mop for heavy-duty floor cleaning in commercial settings.,"Material: Heavy-duty Cotton; Weight: 400g; Features: High absorbency, durable for tough cleaning, ideal for large areas, compatible with professional mop handles.",HDCM001,5.5,./images/products/vileda - rubber gloves (medium).jpg